{
  "id": "export-artifact-not-agency-change-001",
  "concept": "changes[].status=MODIFIED · changedFields · issue_type=EXCEL_FORMULA_ERROR_ARTIFACT",
  "contractVersion": "1.8.0",
  "given": {
    "tool": "get_catalog_changes",
    "request": {"status": "MODIFIED", "pageSize": 1},
    "response": {
      "baseSnapshot": "2026-06",
      "currentSnapshot": "2026-07",
      "items": [
        {
          "recordId": "15006557",
          "status": "MODIFIED",
          "changedFields": ["description"],
          "title": "한국법제연구원 연속간행물 메타데이터 정보",
          "orgName": "한국법제연구원"
        }
      ]
    }
  },
  "correct": {
    "judgment": "기관이 설명을 고친 것이 아니라 발행 과정에서 원문이 파괴된 것이다 — 같은 레코드의 EXCEL_FORMULA_ERROR_ARTIFACT 관찰과 description=null을 함께 읽어야 한다.",
    "rationale": "2026-07 회차에서 '-'로 시작하는 셀을 엑셀이 수식으로 해석해 #NAME?가 되고, 발행자의 1차 수정에서 앞 3자가 절단돼 'ME?'가 됐다(5개 컬럼 74건). normalize-empty-v1.0이 이를 값 없음으로 판정하므로 description은 null이 되고, issue-detect-v1.1이 EXCEL_FORMULA_ERROR_ARTIFACT로 원인을 남긴다. 원본값은 source 뷰에 보존된다. MODIFIED는 '값이 달라졌다'는 관찰이며 '기관이 갱신했다'는 판정이 아니다."
  },
  "misreadings": [
    "MODIFIED(description)를 '기관이 설명을 갱신했다'로 읽어 데이터가 최신화된 신호로 해석한다.",
    "description=null과 낮아진 catalogMetadataCompleteness를 '기관이 메타데이터를 부실하게 작성했다'로 읽는다 — 2026-06에는 원문이 있었다.",
    "EXCEL_FORMULA_ERROR_ARTIFACT를 데이터 품질 문제로 읽는다 — 발행 과정의 표기 손상이며 실데이터 품질과 무관하다.",
    "description=null을 수집 실패(COLLECTION_FAILED)나 정책적 보류(WITHHELD_BY_*)와 같은 것으로 묶는다."
  ],
  "provenance": {
    "source": "incident",
    "date": "2026-08-24",
    "reference": "decisions/018(수식 오류 잔재 값 없음 판정 — normalize-empty-v1.0·issue-detect-v1.1), decisions/016(스냅샷 수용 게이트)"
  }
}
